{
  "laboratory": "Northgate Diagnostics",
  "report_id": "ND-2027-004512",
  "patient": {
    "name": "Rowan Testcase",
    "date_of_birth": "1984-07-12",
    "sex": "female"
  },
  "collected_on": "2027-04-03",
  "reported_on": "2027-04-04",
  "ordering_clinician": "Imogen Fictive",
  "results": [
    {
      "test": "Haemoglobin",
      "value": 13.8,
      "unit": "g/dL",
      "reference_range": "12.0-15.5",
      "flag": null
    },
    {
      "test": "White cell count",
      "value": 11.6,
      "unit": "10^9/L",
      "reference_range": "4.0-11.0",
      "flag": "high"
    },
    {
      "test": "Platelets",
      "value": 250,
      "unit": "10^9/L",
      "reference_range": "150-400",
      "flag": null
    },
    {
      "test": "MCV",
      "value": 88,
      "unit": "fL",
      "reference_range": "80-100",
      "flag": null
    }
  ]
}
